{
  "schema": "nexus-s5-responses-v3",
  "generated_on": "2026-08-21",
  "student_id": "elyes-kefi",
  "student_name": "Elyes KEFI",
  "level_key": "3e",
  "subject": "Mathématiques",
  "status": "awaiting_assessment",
  "assessed_on": null,
  "estimated_duration_minutes": 37.75,
  "observed_duration_minutes": null,
  "source_of_truth": "les documents élèves distribués ne sont pas modifiables ; ce fichier ne contient que la correction.",
  "instructions": {
    "saisie": "critère par critère. Jamais au niveau de l'item : c'est du critère que viennent le score par compétence et le classement N-1 / passerelle.",
    "criteria[].score": "points attribués à ce critère, entre 0 et max_points. Le crédit partiel est admis. Aucune valeur n'est complétée automatiquement.",
    "criteria[].error_codes": "codes d'erreur du critère, et de lui seul. Ne jamais recopier ici les codes d'un autre critère du même item.",
    "criteria[].observation": "note libre facultative, propre à ce critère.",
    "criteria[].accepted_alternative_method": "true lorsque l'élève emploie une méthode mathématiquement correcte différente de celle du corrigé. Ce n'est jamais une erreur.",
    "criteria[].criterion_scoring_status": "« scored » lorsque le critère est corrigé ; « requires_human_allocation » lorsque la ventilation n'a pas pu être établie ; « neutralised » lorsque aucune correction équitable n'est possible et que le critère est retiré des deux décomptes.",
    "criteria[].virtual_subcriteria": "présent uniquement pour un critère mixte : ce sont ces lignes qui se saisissent, le critère d'origine en est la somme.",
    "responses[].teacher_observation_non_scored": "remarques enseignantes hors barème. Elles n'entrent ni dans le score, ni dans le profil d'erreurs, ni dans les priorités, ni dans le bilan.",
    "confidence": "1 à 4, uniquement pour les items marqués confidence_probe ; null sinon.",
    "observed_duration_minutes": "durée réellement observée, si une mesure pédagogiquement raisonnable a été possible. null sinon. Ne jamais interrompre un élève dans le seul but de calibrer le modèle."
  },
  "responses": [
    {
      "item_id": "3E_ELYES_KEFI_A1",
      "ref": "A1",
      "part": "A",
      "kind": "commun",
      "max_points": 1,
      "estimated_duration_minutes": 1.0,
      "observed_duration_minutes": null,
      "confidence": null,
      "confidence_probe": false,
      "criteria": [
        {
          "criterion_id": "3E_ELYES_KEFI_A1_c1",
          "analysis_skill_id": "M3E_REL_01",
          "original_skill_id": "M3E_REL_01",
          "curriculum_scope": "n_minus_1",
          "evidence_type": "automatisme",
          "subpart": "1",
          "desc": "résultat $7$ exact",
          "max_points": 1,
          "score": null,
          "error_codes": [],
          "observation": null,
          "accepted_alternative_method": false,
          "criterion_scoring_status": "pending"
        }
      ],
      "teacher_observation_non_scored": []
    },
    {
      "item_id": "3E_ELYES_KEFI_A2",
      "ref": "A2",
      "part": "A",
      "kind": "commun",
      "max_points": 1,
      "estimated_duration_minutes": 1.0,
      "observed_duration_minutes": null,
      "confidence": null,
      "confidence_probe": false,
      "criteria": [
        {
          "criterion_id": "3E_ELYES_KEFI_A2_c1",
          "analysis_skill_id": "M3E_FRAC_02",
          "original_skill_id": "M3E_FRAC_02",
          "curriculum_scope": "n_minus_1",
          "evidence_type": "automatisme",
          "subpart": "1",
          "desc": "$\\frac{3}{2}$ ou $1{,}5$ exact",
          "max_points": 1,
          "score": null,
          "error_codes": [],
          "observation": null,
          "accepted_alternative_method": false,
          "criterion_scoring_status": "pending"
        }
      ],
      "teacher_observation_non_scored": []
    },
    {
      "item_id": "3E_ELYES_KEFI_A3",
      "ref": "A3",
      "part": "A",
      "kind": "commun",
      "max_points": 1,
      "estimated_duration_minutes": 1.0,
      "observed_duration_minutes": null,
      "confidence": null,
      "confidence_probe": false,
      "criteria": [
        {
          "criterion_id": "3E_ELYES_KEFI_A3_c1",
          "analysis_skill_id": "M3E_LIT_02",
          "original_skill_id": "M3E_LIT_02",
          "curriculum_scope": "n_minus_1",
          "evidence_type": "automatisme",
          "subpart": "1",
          "desc": "$4x-11$ exact",
          "max_points": 1,
          "score": null,
          "error_codes": [],
          "observation": null,
          "accepted_alternative_method": false,
          "criterion_scoring_status": "pending"
        }
      ],
      "teacher_observation_non_scored": []
    },
    {
      "item_id": "3E_ELYES_KEFI_A4",
      "ref": "A4",
      "part": "A",
      "kind": "commun",
      "max_points": 1,
      "estimated_duration_minutes": 1.5,
      "observed_duration_minutes": null,
      "confidence": null,
      "confidence_probe": false,
      "criteria": [
        {
          "criterion_id": "3E_ELYES_KEFI_A4_c1",
          "analysis_skill_id": "M3E_EQ_01",
          "original_skill_id": "M3E_EQ_01",
          "curriculum_scope": "n_minus_1",
          "evidence_type": "procedure",
          "subpart": "1",
          "desc": "$x=6$ avec au moins une étape écrite",
          "max_points": 1,
          "score": null,
          "error_codes": [],
          "observation": null,
          "accepted_alternative_method": false,
          "criterion_scoring_status": "pending"
        }
      ],
      "teacher_observation_non_scored": []
    },
    {
      "item_id": "3E_ELYES_KEFI_A5",
      "ref": "A5",
      "part": "A",
      "kind": "individuel",
      "max_points": 1,
      "estimated_duration_minutes": 1.0,
      "observed_duration_minutes": null,
      "confidence": null,
      "confidence_probe": false,
      "criteria": [
        {
          "criterion_id": "3E_ELYES_KEFI_A5_c1",
          "analysis_skill_id": "M3E_FRAC_02",
          "original_skill_id": "M3E_FRAC_02",
          "curriculum_scope": "n_minus_1",
          "evidence_type": "automatisme",
          "subpart": "1",
          "desc": "$\\frac16$ ou une écriture équivalente exacte",
          "max_points": 1,
          "score": null,
          "error_codes": [],
          "observation": null,
          "accepted_alternative_method": false,
          "criterion_scoring_status": "pending"
        }
      ],
      "teacher_observation_non_scored": []
    },
    {
      "item_id": "3E_ELYES_KEFI_A6",
      "ref": "A6",
      "part": "A",
      "kind": "individuel",
      "max_points": 1,
      "estimated_duration_minutes": 1.0,
      "observed_duration_minutes": null,
      "confidence": null,
      "confidence_probe": false,
      "criteria": [
        {
          "criterion_id": "3E_ELYES_KEFI_A6_c1",
          "analysis_skill_id": "M3E_LIT_02",
          "original_skill_id": "M3E_LIT_02",
          "curriculum_scope": "n_minus_1",
          "evidence_type": "automatisme",
          "subpart": "1",
          "desc": "$11x-5$ exact",
          "max_points": 1,
          "score": null,
          "error_codes": [],
          "observation": null,
          "accepted_alternative_method": false,
          "criterion_scoring_status": "pending"
        }
      ],
      "teacher_observation_non_scored": []
    },
    {
      "item_id": "3E_ELYES_KEFI_B1",
      "ref": "B1",
      "part": "B",
      "kind": "commun",
      "max_points": 2,
      "estimated_duration_minutes": 4.0,
      "observed_duration_minutes": null,
      "confidence": null,
      "confidence_probe": false,
      "criteria": [
        {
          "criterion_id": "3E_ELYES_KEFI_B1_c1",
          "analysis_skill_id": "M3E_GEO_01",
          "original_skill_id": "M3E_GEO_01",
          "curriculum_scope": "n_minus_1",
          "evidence_type": "justification",
          "subpart": "1",
          "desc": "relation correcte, théorème cité, $AC=16$ cm",
          "max_points": 1.5,
          "score": null,
          "error_codes": [],
          "observation": null,
          "accepted_alternative_method": false,
          "criterion_scoring_status": "pending"
        },
        {
          "criterion_id": "3E_ELYES_KEFI_B1_c2",
          "analysis_skill_id": "M3E_GEO_01",
          "original_skill_id": "M3E_GEO_01",
          "curriculum_scope": "n_minus_1",
          "evidence_type": "controle",
          "subpart": "2",
          "desc": "contrôle de vraisemblance argumenté",
          "max_points": 0.5,
          "score": null,
          "error_codes": [],
          "observation": null,
          "accepted_alternative_method": false,
          "criterion_scoring_status": "pending"
        }
      ],
      "teacher_observation_non_scored": []
    },
    {
      "item_id": "3E_ELYES_KEFI_B2",
      "ref": "B2",
      "part": "B",
      "kind": "commun",
      "max_points": 2,
      "estimated_duration_minutes": 5.75,
      "observed_duration_minutes": null,
      "confidence": null,
      "confidence_probe": true,
      "criteria": [
        {
          "criterion_id": "3E_ELYES_KEFI_B2_c1",
          "analysis_skill_id": "M3_TRIGO_COS_NM1",
          "original_skill_id": "M3E_TRIG_01",
          "curriculum_scope": "n_minus_1",
          "evidence_type": "procedure",
          "subpart": "1",
          "desc": "côtés correctement nommés et rapport correct",
          "max_points": 1,
          "score": null,
          "error_codes": [],
          "observation": null,
          "accepted_alternative_method": false,
          "criterion_scoring_status": "pending"
        },
        {
          "criterion_id": "3E_ELYES_KEFI_B2_c2",
          "analysis_skill_id": "M3_TRIGO_COS_NM1",
          "original_skill_id": "M3E_TRIG_01",
          "curriculum_scope": "n_minus_1",
          "evidence_type": "automatisme",
          "subpart": "2",
          "desc": "mesure de l'angle exacte au degré près",